,date,author,text,followers,status,favourites,retweets,replies,quotes,media,word_count,char_count,stop_words,#tag,@,numaric,upercase,URLs,emojis_count
2214,2022-12-10 10:13:45+00:00,suryzcooking,good caramel apple crisp cheesecakerecipe ,38009,14881,138201,122,15,7,1,9,93,0,0,1,0,1,2,0
2215,2022-11-16 11:59:12+00:00,dearsusanbranch,it have it be always a fight to the finish between pumpkin cheesecake and cranberry apple crisp for thanksgiving both be good hot apple crisp amp cranberry with vanilla ice cream be like a fall day where sun be warm and wind be chillboth recipe in my autumn book ,15209,72716,195880,25,16,1,3,47,289,17,0,0,0,0,1,2
2216,2022-11-07 01:29:05+00:00,SoyyMilk2,caramel apple crisp cheesecake by cake thanksgiving menu come soon ,8818,9016,6049,25,5,8,1,13,100,1,0,0,0,0,1,1
2217,2022-08-17 00:27:15+00:00,revrrlewis,lobster be like if crab be expensive and bland ,63739,75266,133155,9,21,4,0,9,47,4,0,0,0,0,0,0
2218,2022-07-29 18:02:54+00:00,longbeachgriffy,you can not just put anything on mac n cheese and sell it mac be taste bland asf then you all throw a lobster on top and call it gourmet stop ,264257,17374,4147,31,13,5,0,29,158,8,0,0,0,13,0,0
2219,2022-12-13 17:17:17+00:00,WVHotline,a new shroom n swiss whopper melt have be spot on the burger king sitenot yet available the melt feature two flame - grill whopper jr patty swiss cheese fire - roast mushroom and royal sauce on two slice of toast breadinorout ,177,367,178,8,12,0,1,43,300,11,1,2,0,1,1,0
2220,2022-12-07 04:20:06+00:00,AmberlyJAzriel,bacon chive and cheddar double smash burger on toast bread with lettuce tomato onion and dill pickle azrielsacre ,11185,26900,148471,6,15,1,1,19,144,4,1,0,0,0,1,0
2221,2022-12-05 17:20:10+00:00,JustNaz7,people be like I make the good burger ever n then the bun be not be not be not have not have not even toast ,6718,88265,124078,7,2,0,0,18,83,7,0,0,0,1,0,0
2222,2022-11-22 12:09:22+00:00,krstn_rzhkv_nft,the st day go well I think I have plan to get up at am but I get up at pm I take the bus and drive to the center for an hour by the time I get there it be almost sunset I get a fresh squeeze watermelon juice and shrimp soup then I go for a walk in the zoo ,516,10042,12112,10,10,0,1,63,297,25,0,0,0,7,1,0
2223,2022-11-17 03:00:05+00:00,Banditos916,banditos party tray modelo especial dress with our signature chamoy and tajin complete with bandito shrimp pineapple mango and cucumber fresh lime juice tajin and chamoy throughout ,762,777,658,3,1,0,1,30,246,6,0,0,1,0,2,0
2224,2022-10-31 16:32:38+00:00,MiaYim,feed a delicious bowl of shrimp spaghetti and he have the nerve to complain about I drink my own damn juice the disrespect I know I should have put draino in his meal ,308124,85870,48424,17,12,0,0,33,181,14,0,1,0,2,0,0
2225,2022-08-07 15:09:51+00:00,gregmoodie,in this preview of tomorrows comic strip the leadership candidate clarify his definition of level up what it boil down to be make the rish risher you will share and not be tardy for the full delicacy at be sharpish scottishindependence indyref levellingup ,9125,42885,11066,13,2,0,1,44,304,17,3,0,0,0,1,0
2226,2022-07-24 21:14:52+00:00,AoDespair,my god the raise - pinkie delicacy of this for the record when I block you on twitter it mean you need to wade knee - deep into some stagnant estuarine backwater of miasmatic venereal misadventure curl into a fetal pose of self - loathing and then die of boil and heartbreak ,322873,102031,5897,40,24,6,0,47,301,19,0,0,0,1,1,0
2227,2022-11-15 19:44:30+00:00,EasyHomeMeals,a anytizer snack make for the perfect party appetizer whether you want to serve boneless chicken bite wing popcorn chicken or even chicken fry there have there be a snack for everyone holidayhack ,3439,16882,7014,17,6,0,1,33,263,9,5,1,0,1,2,0
2228,2022-01-26 05:02:21+00:00,willmckinley,popcorn as an appetizer and vintage cartoon project on a big screen I be in heaven ,14694,241545,318972,4,22,0,0,18,114,7,0,0,0,1,1,1
2229,2022-01-04 04:02:06+00:00,winonaparadise,in we be no long have popcorn for dinnerwe be have it as an appetizer for ice cream dinner ,23357,29714,70673,10,2,1,0,21,105,11,0,0,1,0,0,0
2230,2022-12-14 15:45:37+00:00,lndian_Bronson,I eat the s breakfast I have a bowl of frosted flake two thick piece of buttered toast and a tall glass of orange juice some pulpi be so sick ,32128,56029,116279,56,55,9,0,31,151,11,0,0,0,3,0,0
2231,2022-12-10 14:03:24+00:00,DalbidEU,if you be desperate for an easy job you might sound like poor leeanderson put himself up as a patriot an environment expert an economist he have he be plastic an actor useless at all of it a toxic tory who think he understand p nutrition as thick as the toast he have he be become ,30894,102455,58129,14,1,0,2,51,304,19,1,0,0,1,1,0
2232,2022-12-04 07:58:31+00:00,therealziggyb23,interviewer what have what be your favorite food kevin gate I love eat cinnamon toast crunch out a thick bitch ass ,20668,21054,18894,5,1,1,0,18,112,3,0,0,0,1,0,0
2233,2022-08-12 09:12:07+00:00,CGMeifangZhang,do you know that a bowl noodle in shandong take kind of auxiliary vegetable and pickle to makethe refreshing noodle with the aroma of various vegetable be definitely the delicacy of the world fridaymorne food ,127840,48871,4103,3,2,2,3,37,255,15,4,0,1,0,1,0
2234,2022-05-11 16:21:45+00:00,LAZoo,eat your vegetable chomp into a cool crunchy cucumber on a warm day be so refreshing chimpanzee like oliver here be omnivore they consume a wide variety of tasty tidbit include leave flower shoot vegetable fruit insect egg and even meat ,38372,21561,16902,16,8,1,1,44,301,10,1,0,0,0,1,2
2235,2022-03-15 19:42:57+00:00,junedarville,one of my most favorite asian salad a refreshing thai green papaya salad pack with flavorful crunchy vegetable gtgt ,30501,19112,204815,6,3,0,1,29,215,5,1,0,0,0,2,3
2236,2022-11-09 17:13:54+00:00,Poutine_Sheep,flip through pageswhen summon a gluttony demonimp one of the requirement be leave food in the middle of the circleit do not matter if you forgot some garnish or something do not step in as they be about to materialize unless your goal be to end up in their gut ,9751,10096,23460,5,3,0,0,51,279,29,0,0,0,0,0,0
2237,2022-11-07 13:25:54+00:00,Snack_Memories,as a gimmick they should list the whole recipe but then have a special section for a finish touch or garnish for right before the food be serve call just one more thing ,17510,5970,30627,11,2,0,0,34,207,18,0,0,0,0,1,0
2238,2022-11-05 04:40:55+00:00,mohd_ridakhan,persimmon apple smoothie as a breakfast today with the healthy ingredient persimmon apple oats milk amp garnish it with little cocoa pwdr dark chocolate if u wnt to add sugar then u can add it fruit chocolate smoothie food foodie ,2444,63724,65872,5,6,0,2,46,290,11,7,1,0,0,1,2
2239,2022-12-14 12:35:51+00:00,ManvsAle,thick creamy amp dank well describe allen which be a dneipa brew in cornwall mva ,3854,12661,97687,9,5,1,1,34,304,4,2,17,0,1,1,3
2240,2022-12-03 17:28:30+00:00,TheSmokeyCarter,thick cut pork belly slice from costco slice the pork on a diagonal then on the opposite diagonal on the other side fan it out perfect for ultimate crispiness squash new potato cabbage with chorizo amp a creamy mustard white wine gravy ,10120,18266,34123,23,13,1,4,44,273,14,0,0,0,0,1,1
2241,2022-12-02 16:02:42+00:00,Annabellestoes,the perfect combo of thick and creamy foot foot toe sole foot worship ,7357,1316,2297,123,18,1,1,15,98,2,0,0,0,0,1,1
2242,2022-02-23 01:31:18+00:00,leonvilhena_,dialogue chocolate new formula fair trade microwave well before recycle calcium sodium nutrition classichandmade collage loop xtz ,2244,7032,6463,13,1,1,1,25,246,1,0,0,1,1,4,0
2243,2022-07-31 23:55:00+00:00,BGG186,marcona almond crust halibut with chickpea marsala and lemon garlic bok choy stg ,4817,6961,10322,6,1,0,2,14,106,2,0,0,0,0,1,0
2244,2022-04-30 22:18:37+00:00,RussellVine1981,halibut with meyer lemon and caper and sliver almond with a couple of good french white wine ,24940,69854,169868,5,7,1,2,18,122,6,0,0,0,0,1,0
2245,2022-11-17 16:16:56+00:00,GaryLegum,already work on my strategy for not go nuts over all this horseshit the next two year mostly it involve stab myself in the eye and eardrum with a barbecue fork ,16128,78855,21803,3,6,0,0,32,199,17,0,0,0,0,1,0
2246,2022-06-21 20:10:30+00:00,CllrBattley,well the interfaith barbecue in the municipal garden be an almighty cluster - fk massive punch - up between the episcopalian and the jainist and a nun go nuts with a spatula one thing I have take away from the whole ghastly experience - never throw a lamb chop at a druid ,45065,1656,1775,26,10,3,0,47,278,20,0,0,0,0,0,0
2247,2022-11-29 08:02:28+00:00,cookingphotos,tbt my first baked cheesecake it be a little over cooked but the blueberry syrup fill the crack bake food foodphotography homebake dessert ,830,2059,1819,19,4,0,1,25,180,8,6,0,0,0,1,1
2248,2022-11-23 03:36:09+00:00,Bitemefuker,I be go all june cleaver tomorrow bake pie and cheesecake I be go to make each of their fave dessert pecan pie strawberry cheesecake and oreo pie I be not go to lie the last one hurt I a little I think oreos be gross ,20855,116141,109340,7,56,3,0,43,237,15,0,0,0,1,0,1
2249,2022-11-12 09:05:19+00:00,PatBafo,we bake cheesecake under this rhulani ball ,34370,121711,80430,28,21,9,1,9,71,2,0,0,0,0,1,2
2250,2022-11-27 00:18:02+00:00,bonappetit,juicy pork meatball nestle in a fiery creamy harissa - coconut sauce be ready in under an hour ,3385722,84531,5227,14,3,0,0,17,123,6,0,0,0,0,1,0
2251,2022-09-30 10:08:57+00:00,LinoMazuran,thank to our fiery cracker and followbackfriday go from my comfortable follower to almost today fell a bit intimidate and overwhelmedthank everyone for a follow cheese cracker and pork market up and onwards ,1385,1800,36985,23,5,0,1,38,264,15,1,0,2,0,1,3
2252,2022-08-25 18:00:27+00:00,theblackfarmer,it have it be national burger day why not celebrate with my banging burger box which include succulent pork amp apple fiery pork leek amp chilli and beef amp chilli to meaty steak burger this selection be sure to impress theblackfarmer nationalburgerday supportlocalfarmer ,13738,14029,3789,5,1,0,1,42,307,8,3,0,0,0,1,1
2253,2022-12-04 23:04:48+00:00,DoctorTro,guarantee you will see warning label on beef before you see a warning label on candy let alone on the packaging of new man - make ingredient like those in fake meatthey want to push the illness prevent the natural cure while mandate their solution ,74131,63223,9,44,8,2,0,48,268,19,0,0,0,0,0,4
2254,2022-11-23 18:56:20+00:00,herb_lust,corn beef reuben w sauerkraut and a bottle of liquid candy wedge inn stamford ct ,1964,707,10338,16,5,0,1,16,108,3,0,0,0,1,1,0
2255,2022-11-10 06:23:46+00:00,prettydamnhuge,for some reason after leg day I get unreasonably ravenously hungry so this be a post - leg day pic after eat whole pickle a protein shake and my beefrice dinner aaaand maybe a fistfull of gummy candy ,22992,14196,95534,17,2,1,1,38,238,12,0,0,1,1,1,1
2256,2022-07-30 06:39:18+00:00,akintoladebb,this be bara not watermelon nor tagiri english name bitter melondice into cube or piece put in a plastic bottle add up to it leave to soak for hrs and take shot use this once a month pls and do not leave the house after use ,1090,4383,1506,21,8,0,1,48,266,21,0,0,0,0,1,1
2257,2022-07-09 19:09:28+00:00,g_diets_,once it bring small suffering it have it be good that have that be how you drink bitter leaf juice because you think the bitterness reduce blood sugar now you be eat watermelon seed ,74378,68169,33707,41,16,4,0,28,171,8,0,0,0,0,0,0
2258,2022-06-07 12:03:40+00:00,dhyanfoundation,rescue from bitter condition gaumata be treat to juicy watermelon everyone deserve love dfrescue cow shelter ,3903,9506,2233,37,6,0,1,18,154,3,3,0,0,0,1,1
2259,2022-09-19 15:43:40+00:00,Abdulrazaqkhanz,wannan tace ma awara wannan tace ma gullisuwa wannan tace ma shawaram may sausage wannan tace ma roast fish wannan tace ma milkcake wnn tace ma doughnut wannan tace this wannan tace that har wata wai mandi rice ce ko mayku dallah bamu da kudi haba ,2871,4351,45863,5,5,0,0,47,260,3,0,0,0,0,0,1
2260,2022-11-28 08:50:10+00:00,calorie_guidee,wheat noodle amp carrot noodle ,103801,174,3,18,5,3,1,6,59,0,0,0,0,0,1,0
2261,2022-10-25 13:06:53+00:00,atheartpanadera,the tiny carrot on this spiced whole wheat carrot cake specifically ,3505,54697,148101,13,5,0,2,12,95,3,0,0,0,0,1,1
2262,2022-10-02 20:46:30+00:00,ResePeace1,this be how I vegan sandwich for lunch marinate tofu salad sandwich fill w shred carrot chop bps amp zuke with a miso - tahini - mayo - dijon dress on toast whole wheat w cashew chz spread pickle purple cabbage amp tomato yummy ,946,5317,48652,4,2,0,1,40,276,7,1,0,0,1,1,1
2263,2022-12-06 20:00:10+00:00,CincinnatiZoo,giraffe have a foot - and - a - half long tongue that can nimbly strip leave amp fruit from a branch thick saliva protect their tongue from the thorn of its favorite food source the acacia tree they spend much of the day feed and can eat up to pound a day ,328848,21123,8839,156,15,13,1,49,290,20,0,0,1,0,1,0
2264,2022-12-01 14:06:33+00:00,grrls_sxy_shoes,that have that be exactly what my fake christian cop step - dad do to I at - it scar I for life to strip down in front of he and have he beat I senseless with his thick leather police belt I could not sit for at least week and it be not the only time just the bad one ,2681,17644,25869,7,6,2,0,56,299,28,0,0,1,1,1,0
2265,2022-11-19 22:13:42+00:00,ClickingSeason,a good ny strip steak must be turn not once but thrice it be thick enough to stand on its side fat cap go down first release the tallow the steak will be fry in herb crust recommend ,17446,9721,38891,3,7,0,0,38,198,14,0,0,0,2,0,0
2266,2022-04-10 03:14:58+00:00,akuabossgirl,kcm anibr nti I be here eat braise rice angwa moo with grind pepper at am man for survive ,5102,59809,70413,11,7,2,0,20,105,4,0,0,0,0,0,2
2267,2022-10-12 21:10:11+00:00,orangecastle4,have trouble praise your mrty want to let mrty know he have he be a good boy give he mrty cookie now in delicious hamburger flavor and grandpa cock flavor get it while supply last ,716,14975,37899,13,2,0,0,32,185,9,0,0,0,0,0,0
2268,2022-09-15 08:04:44+00:00,brainybirds_sa,one footed atilla be a lorikeet when you give your bird a treat make sure it have it be something healthy and true to their dietary requirement not a cookie or a bite of your hamburger their health be in our hand ,1492,4426,6040,16,3,0,1,40,238,19,0,0,0,0,1,0
2269,2022-09-06 13:24:12+00:00,smoothsale,perception the hamburger consist of cookie for the bun with nut for sesame seed and peppermint patty for meat ,55500,348940,113856,3,1,0,1,20,142,7,0,0,0,0,1,0
2270,2022-11-03 10:08:20+00:00,markdredge,beer a tasting course be publish today focus on the wonderful flavour of beer it look at how ingredient and process give flavour with beer style detail it have it be the most visual book I have write with lot of cool infographic and illustration ,13852,20158,2274,11,12,2,4,43,282,15,0,0,1,4,1,0
2271,2022-10-27 00:27:13+00:00,GrineX_Zeox,commission for feature my boss monster form can not seem to stop taste the ingredient as I help decorate ,7092,12271,31864,35,3,0,1,20,146,6,0,1,0,1,1,0
2272,2022-10-23 12:53:44+00:00,CurateByo,come and spend the weekend taste gorgeous zimbabwean wine pair with delicious food prepare with indigeneous ingredient in the lush land of matopos we will also be have a painting session host by nationalartgalleryinbyo or kuva online for ticket ,26087,110492,78679,10,2,0,1,40,304,13,1,0,0,0,1,0
2273,2022-12-13 16:15:15+00:00,robertlufkinmd,increase risk for diabetes arthritis hypertension heart attack stroke fatty liver cancer and alzheimers disease solution- reduce food that drive insulin resistanceavoid process carbs sugar refine starch process fat seed vegetable oil and grain ,55106,12968,7193,40,12,6,1,36,301,4,0,0,0,0,1,0
2274,2022-12-12 21:19:13+00:00,ElieJarrougeMD,remove sugar refine carb and seed oil from the diet have consistently lead to tremendous weight loss low inflammation and chronic pain low blood pressure reversal of type diabete and fatty liver this tell you that they all have the same root cause ,73087,4852,10397,169,15,6,0,44,266,15,0,0,1,0,0,0
2275,2022-12-12 16:35:42+00:00,robertlufkinmd,I have no dog in the diet race I have be vegetarian vegan omnivore carnivore low fat low carb amp almost everything in betweenthe single principle I now follow be to avoid process foodsrefine carbohydrate amp sugarsindustrial seed oil canola etcgrain ,55106,12968,7193,25,14,4,1,46,309,12,0,0,0,3,1,0
2276,2022-12-07 01:42:02+00:00,Living_Lou,switch it up tomorrow by make this fabulous frittata recipe use eggs milk chili flakes cheddar cheese bacon asparagus fresh parsley snd crumble feta cheese recipe foodie delicious ,81968,84527,154263,16,1,0,3,30,246,4,2,0,0,1,2,0
2277,2022-11-04 14:20:51+00:00,GoldBlooded79,the next smash or pass be actually something I have never have myself but let we see what you all think grit breakfast bowl creamy cheesy grit be top with crumble pan - fried sausage and scramble egg smash or pass ,19509,62422,176815,51,569,26,1,37,246,14,0,0,0,0,1,0
2278,2022-08-12 00:12:02+00:00,Living_Lou,switch it up tomorrow by make this fabulous frittata recipe use eggs milk chili flakes cheddar cheese bacon asparagus fresh parsley snd crumble feta cheese recipe foodie delicious ,81968,84527,154263,10,1,0,3,30,246,4,2,0,0,1,2,0
2279,2022-02-09 10:38:06+00:00,presentcorrect,pizza topping feature in the teenage mutant ninja turtlesmarshmallow pepperonijelly bean sausageguacamole marshmallowchocolate sprinkle clam saucepeanut butter salami yogurttunapeanut buttergrape jellychocolate fudgesardinechilliwhippe creamanchovybanana ,98762,68572,10861,13,2,1,0,31,280,2,0,0,0,0,0,0
2280,2022-07-28 07:50:57+00:00,rogueytwinkles,I be back tonight dinner herbe panko crumb lamb cutlet with asian inspire noodle ,1857,48900,66153,4,11,1,1,16,118,2,0,0,0,0,1,3
2281,2022-01-20 14:10:42+00:00,GuruAnaerobic,city fox be not be not vermin they be a wonderful part of urban nature some have a tough life this one be forage for food at noon probably very hungry so I rush into the house to get a tin of mackerel ,26089,61967,135572,3,14,0,1,40,230,17,0,0,0,1,1,0
2282,2022-11-21 11:41:41+00:00,pvt_ak,pick veg for today dinner - organic home growing be such an amazing way of life - but a little damp at times allotmentlifegardeningtwitter ,11961,12301,38237,7,8,0,1,27,171,8,2,0,0,0,1,1
2283,2022-07-28 23:58:43+00:00,vanbadham,I just want organic street band to form wherever this damp noodle go and play brave sir robin run away from monty python and the holy grail until every american schoolchild know the word ,114164,27524,76538,15,8,0,0,35,218,11,0,0,0,1,1,0
2284,2022-07-28 23:56:56+00:00,vanbadham,I just want organic street band to form wherever this damp noodle go and play brave sir robin run away from monty python and the holy grail until everyone american schoolchild know the word ,114164,27524,76538,11,5,0,0,35,221,11,0,0,0,1,1,0
2285,2022-10-05 00:35:54+00:00,alisoncassis1,stop put punpkin in everything pumpkin sticky toffee pudding pumpkin oatmeal bake pumpkin ravioli why stop it right now ,5374,19189,106084,3,3,0,1,20,155,1,0,0,0,6,1,0
2286,2022-12-13 11:28:50+00:00,SmallholdersUK,good morningtoday I be make shrimp taco on corn and flour tortilla both homemade with two salsas slaw pickle veg rice and bean I make the carrot jalapeo pickle yesterday ,20355,89416,57682,3,2,1,0,30,188,7,0,0,0,1,0,0
2287,2022-12-06 12:56:59+00:00,iambmorsh,as per wife request make herb infuse saffron rice not long grain chicken breast eggplant saffron dish with side of boil potato w salt black pepper cayenne pepper turmeric potato finish in air fryer not deep fry fry back fry and pickle everything mango ,784,18679,29,8,6,0,4,45,303,8,0,0,0,0,1,1
2288,2022-12-05 00:45:00+00:00,ChefFattyMac,pork belly miso soup w glaze chicken thigh pork belly and miso broth vegetable soup with rice cake and top with spicy pickle carrot braise then glaze sweet chili chicken thigh on a bed of deep fried and crispy rice cake beside a round of crispy sesame naan ,1039,713,3652,15,6,1,2,49,300,10,0,0,0,0,1,0
2289,2022-10-22 16:50:40+00:00,sakie339,do not drink water for hour after food unless you be really thirsty in which case it have it be fine avoid milk coffee tea for an hour beforeafter food they inhibit absorption of nutrientslime juice with skin amp a bit of gingermint help absorption lime pickle be good ,14115,30031,49332,27,13,0,0,48,281,15,0,0,0,0,0,1
2290,2022-04-19 00:08:55+00:00,benpratt9,crawl our way through spread cube of piggery litter spread so far with to go target tha on deep acidic sand in this new lease block to boost om and capital nutrientslime up next to correct ph thank to ,1151,1180,3579,4,4,0,2,46,299,15,1,3,1,1,1,0
2291,2022-12-09 11:38:44+00:00,TheMutaD,I do not know which between fried or boil gonja be the pit whoever vote for that be sub human as the true owner of gonja plantation in this glorious pearl we can assure you that we intend for it to be eat roast ,21495,28747,261812,10,15,2,0,44,249,21,0,0,0,1,1,0
2292,2022-12-05 19:26:25+00:00,theo_swagg,I have eat nigerian jellof no be mouth the jellof here na different level nigerian sabi touch pot roast yam and pepper be another g ted meal ,12424,12984,404659,4,6,3,0,28,154,7,0,0,0,0,0,7
2293,2022-12-04 07:55:36+00:00,Nagginda3,roasted maize be only eat when hot otherwise your jaw might crack ,4967,20722,25849,11,4,3,0,12,69,6,0,0,0,0,0,1
2294,2022-11-17 16:49:40+00:00,nightstar1201,op I go to big hanaro mart near here to buy for kimchi ingredient our jin be there I buy two bundle of raman add spicy and mild flavor boil it in medium taste and enjoy it yummytheastronaut jin ,5819,27157,68069,49,1,0,1,44,282,11,3,1,0,4,2,0
2295,2022-11-13 16:29:46+00:00,BelleStruts,it have it be get expensive to eat in even the junkiest of junk fast food joint so remind your college student kid to add a little balance to their raman staple by add a slice hard boil egg amp some shred lettucegreen hubby load his wcollard green but they be bury ,14373,75125,109989,7,6,0,1,49,307,16,0,0,0,0,1,0
2296,2022-11-02 14:00:55+00:00,kbsoperfect,I after add a boil egg amp some shrimp to my raman for that perfect balance of hood yet gourmet ,11599,16758,35714,82,1,6,1,21,127,9,0,0,0,0,1,0
2297,2022-09-11 00:30:41+00:00,SAVEURMAG,cool yogurt nutty tahini and spicy chilesthis be not your garden variety potato salad recipe ,644890,40787,3836,3,1,1,1,16,143,2,0,0,0,0,2,0
2298,2022-06-04 22:02:01+00:00,sookiesue345,breadfruit nachos with lobster ,2325,13088,57803,4,6,5,3,6,56,1,0,0,0,0,1,1
2299,2022-12-12 20:26:19+00:00,LI_politico,this be annoying - all for a bowl of soup what be we do in the western world all for a chipotle bowl I feel like commercial fishing under capitalism be the problem but if we address that we have we would have to address our sushi and our poached fish and our grill halibut eh ,11350,205273,213088,4,7,0,0,54,299,27,0,0,0,1,1,0
2300,2022-11-25 11:06:35+00:00,stfu__bitchh,you be the jelly to my burgerthe knife to my soupthe glitter to my sushiand the ketchup to my ice cream my point be you be worthless ,39719,104762,99812,21,37,0,0,29,140,14,0,0,0,2,0,0
2301,2022-10-28 10:27:45+00:00,_maruva_,it be actually soup sushi ,8345,67014,32322,6,2,0,0,6,49,1,0,0,0,0,1,0
2302,2022-08-03 01:12:25+00:00,czmcfadden,exquisite description of nachos amp beer from the perkin advertisement in the hotel elevator ,4652,1482,15908,7,5,0,1,15,119,5,0,0,0,0,1,0
2303,2022-12-01 03:24:33+00:00,stevenseagull98,favourite pizza topping by statecorn avocado and carrot as favouritesseriouslysomeone school I ,1142,24066,31153,4,13,0,1,16,130,3,0,0,0,0,1,0
2304,2022-11-18 19:21:24+00:00,SeapointO,avocado amp pineapple belong on pizza top tier ,15012,51696,189984,5,2,0,0,8,54,1,0,0,0,0,0,0
2305,2022-11-16 09:52:46+00:00,MBeckybecks,avocado on everything be the dream if you have not taste this pizza from what be you wait for visit today or order on for deliverypanarottispizza ,129,3513,2640,10,2,0,1,32,216,16,1,1,1,0,1,2
2306,2022-12-14 11:19:01+00:00,Living_Lou,I love love love this quiche florentine recipe that have that be make with a frozen pie crust eggs butter fresh spinach cheese cream milk and egg it be delicious and be easy to freeze too recipe foodie egg ,81967,84527,154263,35,5,2,1,39,258,9,2,0,0,6,2,1
2307,2022-12-12 23:31:01+00:00,Living_Lou,I love love love this quiche florentine recipe that have that be make with a frozen pie crust eggs butter fresh spinach cheese cream milk and egg it be delicious and be easy to freeze too recipe foodie egg ,81967,84527,154263,23,2,2,1,39,258,9,2,0,0,6,2,1
2308,2022-12-02 12:22:01+00:00,Living_Lou,I love love love this quiche florentine recipe that have that be make with a frozen pie crust eggs butter fresh spinach cheese cream milk and egg it be delicious and be easy to freeze too recipe foodie egg ,81967,84527,154263,32,2,0,1,39,258,9,2,0,0,6,2,1
2309,2022-12-02 21:42:46+00:00,thisgrilllife,it have it be a panda kinda day order beef and broccoli with orange chicken obviously do not get that chicken egg roll but no sauce to go with it make I think of what joe pesci saidthey fk at the drive thru ,22563,183326,319624,20,9,1,1,42,257,13,0,1,0,1,1,0
2310,2022-05-21 20:50:24+00:00,thisgrilllife,buncha lunch orange chicken beef and broccoli with fried rice and a chicken egg roll always a great lunch ,22563,183326,319624,38,21,7,1,21,152,5,0,1,0,0,1,0
2311,2022-01-28 01:36:28+00:00,Gspirithorse,my dinner tonightfrom royal china restaurant wonton soupegg rollorange beef sesame chicken brown ricebroccoli ,25982,33490,84131,4,9,1,1,21,157,0,0,0,0,0,1,13
2312,2022-11-16 12:10:00+00:00,Ask4Tay,I hope you all have a great day except the people that eat collard greens turnip greens mustard green neck bone yams cabbage corn bread peas bean soup fry chicken oxtails okra crab leg pickle etc ,451,5700,72,3,10,164,0,37,224,7,0,0,0,1,0,1
