,date,author,text,followers,status,favourites,retweets,replies,quotes,media,word_count,char_count,stop_words,#tag,@,numaric,upercase,URLs,emojis_count
1535,2022-05-06 02:31:47+00:00,amethyst_heels,so excited to try stupendous yr anniversary single malt whiskey age in pedro jimenez barrel absolutely sumptuous - aromatic sherry w a nutty dry - fruit tang amp lovely long finish - boom ,3342,48218,207499,5,3,1,1,32,236,3,0,1,0,0,1,2
1536,2022-04-11 12:46:33+00:00,MilitiaImmacul3,mary take a liter of costly perfume oil make from genuine aromatic nard and anoint the foot of jesus and dry they with her hair the house be fill with the fragrance of the oil john militiaoftheimmaculata ,917,489,162,23,1,0,1,40,248,17,1,0,0,0,1,0
1537,2022-11-29 15:40:06+00:00,LeArielleSimone,I can not stand pancake bread muffin or plain egg first thing in the morning please get I a fruit salad smoothie or oatmeal w hella berry ,88632,164016,90033,9,3,1,0,27,174,11,0,0,0,0,1,0
1538,2022-10-31 00:36:16+00:00,_CynthiaThurlow,oatmeal granola bar sugar sweeten yogurt muffin etcare glorify dessertfor breakfast ,48767,64184,109032,12,7,0,0,13,122,0,0,0,0,0,1,0
1539,2022-08-06 12:59:19+00:00,bad_girl_rae,oatmeal chocolate chip muffinsget in my belly ,156341,23023,48497,4,38,2,1,9,75,2,0,0,0,0,1,1
1540,2022-12-10 18:00:02+00:00,DemGourmetCom,very often the apetizer of the neapolitan christmas eve dinner be a magnificent stuff pizza with escarole raisin pine nuts caper and anchovy cost e for portionslearn how to prepare it recipe cuisine food eve napoli holiday ,683,1510,92423,7,2,0,1,41,299,10,10,0,1,1,2,1
1541,2022-12-03 19:02:01+00:00,Living_Lou,baked salmon cake - yumpattie be make with salmon sweet potato mustard mayo caper follow the full recipe here gtgt salmon food cooking ,81967,84527,154263,18,1,0,1,26,203,6,3,0,0,1,2,0
1542,2022-11-23 07:40:07+00:00,jsomethingmusic,food I make lately at home f - fry chicken wing xo and spring onion f - lemon chicken and caper f - aubergine dumplings sugo and spaghetti f - fry chicken bao ,263120,32133,34909,11,14,4,4,36,204,5,0,0,0,6,1,1
1543,2022-10-19 15:31:09+00:00,skzdeluna,dumple hyunebun cinnamonroll mash potato boba cocount hyunbunbun tortellino cupcake vanilla ice cream tiramisu tangerine chestnut mushroom dough I m go to eat he lovingly ,11862,115631,211783,69,3,4,0,25,203,0,0,0,0,5,1,0
1544,2022-08-14 22:46:00+00:00,afroSauwce,taste of kay soul cupcake cornbread cupcake fill with macyam top with mashed potato and fry chicken it fry cauliflower ,7800,202463,143739,11,2,3,4,23,163,5,0,0,0,0,1,3
1545,2022-05-14 16:55:55+00:00,listentoafae,there be a lot of shitty thing happen in the world so here be something the very opposite of that I make saory cupcake out of cornbread with green pepper mash potato frost and top it with mandarin orange chikn and black garlic ,1678,18595,73460,5,4,0,3,45,287,20,0,0,0,1,1,0
1546,2022-11-30 08:56:26+00:00,marksandspencer,no of daysofchristmas our collection chocolate christmas pudding crunch biscuit these pudding - biscuit hybrid be pack with warm spice and fruit and cover in a smooth milk chocolate coating plus they be more chocolate than biscuit mandsfood mandschristma ,644959,588631,10793,8,5,1,1,39,303,10,3,0,1,0,1,1
1547,2022-11-26 18:48:41+00:00,OnjaliRauf,if the world be busy tell you there be not be not wonderful heart everywhere do not you believe a word of itkilos of spice amp biscuit drop at associationsalam today for hot food prep for our refugee thank you dear donorsyou make yummy thing thing happen ,25079,37416,84048,5,1,1,1,47,307,14,2,1,0,0,1,1
1548,2022-11-18 06:53:59+00:00,PatanjaliBiscu1,patanjali namkeen biscuit be make of atta and very crispy and crunchy enrich with natural hurb amp natural spice which make its very taste very yammypatanjalinamkeenbiscuit patanjalibiscuit patanjaliproduct ,571,1521,1010,9,1,0,1,31,250,11,3,0,0,0,1,0
1549,2022-12-13 20:06:48+00:00,ASovij,-c todayfor breakfast sourdough rye sandwich with porkmushroom sausage and cold smoke salmon avocado fruit coffeeit have be snow for day a lot to shovel luckily the snow be light because of the frostfor dinner pan - fried salmon mash vegetable salad ,1968,78833,265948,11,11,1,4,45,304,12,0,0,1,1,1,1
1550,2022-12-10 18:16:36+00:00,ASovij,-c today for breakfast sourdough rye sandwich with an omelette with cold smoked reindeer and smoke turkey kiwi coffeehubby have an omelette fill with mushroom vegetablesfor dinner I just manage to make a simple vegetable soup season with blue cheese naan ,1968,78833,265948,13,9,1,3,45,303,12,0,0,0,2,1,1
1551,2022-12-10 13:00:01+00:00,Moonstone_game,can you pet the lizard mushroom and coffee cup yes if you like pet good boy wishlist we ,17843,1452,8050,48,8,4,1,23,170,4,0,1,0,0,2,2
1552,2022-11-11 19:55:26+00:00,redrustybbq,finished uphomemade kebabsmade greek gyro style with fry salad and a few hot pepper lettuce and garlic mayo in there somewhere toodeliciousi love this rub for the taste of holiday ,4190,10132,21166,15,25,0,4,36,227,13,0,0,0,1,1,4
1553,2022-08-08 04:01:31+00:00,EMAYGreek,I think I be a good person but the way I react when I see lettuce in a gyro would suggest otherwise ,2340,4380,2760,3,1,2,0,22,104,9,0,0,0,4,0,0
1554,2022-10-16 10:27:12+00:00,transitions0101,jyanino channel the guy debate whether to order cold or hot soba for lunchnino it have be say that you can well differentiate the taste of the soba when it have it be coldfuma reallynino yeahcaption I think mj say thattn my matsumiya crumb ,12417,50132,4727,53,2,2,1,49,293,14,0,0,0,3,1,2
1555,2022-03-07 05:24:10+00:00,FchanHyphen,nakamaru do not like nori seaweed on top of soba noodle look at kame and uedas face as he explain why nori get stuck on lip and tooth and do not change the taste of the noodle in the end ueda go he have he be the most troublesome in kat - tun lol kattun ,529,7265,20021,35,5,4,1,50,293,18,2,0,0,2,1,0
1556,2022-02-07 10:30:26+00:00,peanutshoto,udon amp soba be very similar in their base but vary in their presentation amp tastetdrk be under the media scrutiny feel like he be somehow responsible for dabis actionsby say dabi like udon bkg be remind tdrk that yes dabi be your brother but he have he be also not you ,1290,14822,32649,32,2,0,0,51,288,21,0,0,0,1,0,0
1557,2022-01-05 12:23:31+00:00,Ayigbegirl,not to say that the love of your life can not cook but let we be honest pepper chicken wing have no business taste like sawdust and wet newspaper try lava lover red chilli sauce as a marinade for chicken wing and any other type of meat yes even that ,2167,96068,1709,7,2,0,2,52,296,20,0,1,0,0,1,1
1558,2022-07-13 12:43:41+00:00,SH_nutrition,a new dish for my gf client to try baked tofu in batter amp tortilla chip crumb with courgettes edamame bean amp spring onion on a bed of coconut rice all drizzle with tahini dressing and a scattering of fresh mint nutritioncoach vegan tofu plantbase glutenfree ,2194,43570,18955,12,5,0,1,47,304,12,5,0,0,2,1,0
1559,2022-01-11 07:13:33+00:00,tednaiman,I like dry roasted edamame really pretty good stuff crunchy salty savory and unlike tortilla chip I can stop eat they after I have eat a reasonable amount instead of just eat the entire bag ,86466,41296,92114,4,6,0,1,37,252,10,0,0,0,3,2,0
1560,2022-02-05 00:01:17+00:00,SmithsonianMag,goulash begin as a humble soup - stew cook over an open fire by hungarian herdsman the addition of refined variety of paprika from ground red chilie make the dish an international staple nationalhomemadesoupday ,312594,150175,790,7,1,0,0,33,241,11,1,0,0,0,1,0
1561,2022-03-09 01:02:19+00:00,KosherSoul,sweet - taste potato salad be gross I can take a tiny bit of sweet tart frm pickle if its lemony but I just throw out a decent portion bc very little mustard no lemon no black pepperampthe sweetness of the gherkin be overpower by add sugar like withand no paprika ,69249,182536,162009,5,54,8,0,50,280,18,0,0,0,5,0,0
1562,2022-11-16 18:04:42+00:00,nowthisnews,climate activist from campaign group futuro vegetal pour syrup and beet juice on display case housing artifact in barcelonas egyptian museum in protest of the cop climate conference take place in sharm el - sheikh egypt ,2708300,264754,12715,21,49,86,1,35,253,8,0,0,0,1,1,0
1563,2022-08-26 17:56:25+00:00,spookyghostbong,izzys that guy that will only consume redbull and plain tortilla chip for three day but his dog have a regulate raw food diet with course a day ,478,8831,19511,38,2,2,0,29,149,13,0,0,1,0,0,0
1564,2022-04-14 23:58:02+00:00,ERISTHEPLANET,eat tortilla chip raw be kinda nasty and good at the same time ,79782,19063,82126,9,6,0,0,13,66,5,0,0,0,0,0,0
1565,2022-03-10 05:28:44+00:00,jamie_elizabeth,I can not believe my phone still work this well after be drop in a bowl of raw egg which I then make into a spanish tortilla and feed to people ,74701,22850,43403,4,11,0,0,30,148,16,0,0,0,2,0,0
1566,2022-07-09 02:38:23+00:00,msangelmichelle,sister say she not feel reddish brown amp you all suggest mac chestnut mac cork nyx downtown beauty nicka k coffee or cocoa from the hair store ,2719,25819,185,3,1,0,0,28,180,4,0,0,0,4,1,1
1567,2022-12-09 19:49:06+00:00,HairyAngus,sour mango cucumber and red onion salad affa good with fish ,2799,101588,52945,3,5,0,1,12,85,2,0,0,0,0,1,0
1568,2022-12-08 18:54:12+00:00,DisneyFoodBlog,chef at animal kingdom lodge have also introduce two new bowl first up we have get the chermoula - spice shrimp bowl with grill shrimp pilau rice kale slaw cucumber - tomato salad and chermoula sour cream ,206661,111322,35086,4,1,0,1,33,235,7,0,0,0,0,1,0
1569,2022-11-22 21:09:06+00:00,IceIceBabySA,cucumber hot cheetos gummy bear sour patch amp picosito belt with chamoy lucas lime so fire come through ,3522,2555,123,26,1,6,1,21,142,3,0,0,0,0,1,1
1570,2022-11-24 22:43:19+00:00,doug_hanks,dalip die on thanksgive unable to stand but seemingly enjoy some final taste of his favorite treat cantaloupe watermelon and peanut butter and jelly sandwich ,21132,44648,8242,43,8,4,0,26,195,8,0,0,0,0,1,0
1571,2022-12-06 04:19:18+00:00,Oye_Jahazi,cardamom flavour grated carrot pudding prepare with whole milk and caramelize butter garnish with cashew amp almond ,35641,75164,115541,38,54,8,1,18,150,3,0,0,0,0,1,0
1572,2022-08-22 11:57:51+00:00,sanjanafeasts,carrot cake scone with cardamom cream amp marmalade and so the final countdown begin my new school indian cookbook be fund please help I smash this final by pledge whatever you can or by rte this ,5260,12048,8313,13,3,2,1,42,281,13,0,1,0,0,2,1
1573,2022-08-14 02:25:05+00:00,botanicalcyborg,carrot cake with cardamom brown butter cream cheese frost ,1028,23047,131848,12,11,6,2,10,84,1,0,0,0,0,1,0
1574,2022-08-08 22:07:30+00:00,lnbshr,good soup in no particular order french onion lobster bisque wild mushroom potato leek miso amp sancocho clam chowder sans bacon ,76527,41981,107866,22,20,15,0,21,139,2,0,0,0,0,0,0
1575,2022-03-05 10:02:05+00:00,DLPReport,walt will officially reopen on april the special menu will feature corn chowder chili con carne a new mac and cheese with shiitake mushroom a pineapple upside - down cake vegan chocolate hazelnut cookie skillet and the celebration cake serve under a glass dome ,46036,20770,10846,16,5,1,1,45,302,11,0,0,0,0,1,1
1576,2022-01-08 16:38:46+00:00,bistroongaetzrd,happy saturday everyonewe be in the kitchen prepare some frozen meal for all the busy family out thereavailable todaytomato basil soup clam chowder potato leek soup mushroom soup chilli lasagna available mondaycabbage roll roast beef amp mushroom gravy ,1466,6041,5874,4,1,0,1,43,304,8,0,0,0,0,1,0
1577,2022-09-01 01:45:02+00:00,one_loud_image,oden be a nabe dish prepare with various fish cake daikon boil egg konnyaku kombu seaweed etc slow simmer in a soy sauce - base soupyou can order the swimming or diving goody directly off the huge pot which the chef permanently ,2098,11791,136345,6,3,0,1,48,296,12,0,0,1,0,1,3
1578,2022-12-06 12:00:01+00:00,scentlodge,italian niche perfumery brand mine perfume lab base in naples have just launch at hudson bay and canadian be love carme a sweet spicy - woody scent for she or he that blend spearmint bitter almond jasmine tobacco amp saffron it have it be rich amp wonderful ,12354,3586,1267,25,8,0,1,43,293,12,0,0,0,0,1,0
1579,2022-11-12 23:20:17+00:00,Nickyboy63,vietnamese caramel pork over rice with cucumber salad and edumame on the side bitter sweet umami spicythis have it all ,7670,47233,69537,10,9,0,1,21,150,7,0,0,0,0,1,0
1580,2022-10-06 17:08:55+00:00,hoarse_radish,pho in elbarrioconsidere a vietnamese soup pho be also a staple in laos ours vary slightly from the vietnamese version because of an extra pinch of palm sugar a tenet of lao and thai food be balance the five flavor savory spicy sour bitter and sweetfoodie ,431,2142,2375,8,2,0,1,49,304,18,5,0,0,1,1,0
1581,2022-07-16 19:57:05+00:00,GT_MyNation,what a fantastic humour donate to fulfill dream of harvardyet we have see demand for food shelter and clothing but this one be superb by online mean change ur name to beggar woman of bombayfamour say beggar can not be choos of harvard ,576,28678,16689,16,3,0,0,47,298,17,0,1,0,0,1,0
1582,2022-10-22 13:51:23+00:00,Ricaaduh,I feel for a nice breakfast some salt mackerel wid nuff season in deh yellow yam green banana and dumplin ,8209,320636,12226,6,7,3,0,21,114,4,0,0,0,1,0,0
1583,2022-08-04 07:57:52+00:00,Gh_Cedi_,delicious vegetable soup with swallow ingredientsbig bowl waterleave kg or ounce of goat meat cup crayfish scotch bonnet pepper ml palm oilbig bowl ugu leave flute pumpkinroasted mackerel season cubessalt to taste tablespoon groundbig ivy ,2907,18214,14048,8,2,0,1,49,296,4,0,0,7,2,1,1
1584,2022-04-04 14:39:01+00:00,Chrissy__Dee,want some salt mackerel cook up with season boil dumpling and banana ,3401,53463,152501,7,4,1,0,13,75,4,0,0,0,0,0,1
1585,2022-12-08 14:50:24+00:00,Fishywishy_,very festive fish and chip east coast haddock beer batter piggy in blanket stuffing pattie and mushy pea available throughout the festive season ,1471,778,866,4,4,1,1,34,299,5,0,8,0,0,1,3
1586,2022-10-29 20:20:08+00:00,TizBroken,I pay nearly as much for a sandwich crisp amp a drink at our hospital mamp food outlet today than they do for beer batter haddock thick cut chip amp mushy pea it have it be absolutely disgusting they still have subsidise food gravytrain generalelectionnow toriesout ,20371,38178,162317,89,7,3,0,44,306,14,3,0,0,1,1,0
1587,2022-09-20 11:01:26+00:00,Andr6wMale,other quintessential british comfort classic lardy pole kidney mash pie mushy bean bacon log boil cabbage tea sticky liver pudding beer nog pasty gurgle amp spume amersham egg jelly scouse ,37207,170494,461987,12,20,1,0,41,255,0,0,0,0,0,1,0
1588,2022-11-28 15:01:59+00:00,NIDDKgov,diabetesmonth tip choose fruit and vegetable whole grain lean meat bean nuts or seed and non - fat or low - fat milk and cheese ,12793,10280,3216,7,1,0,1,23,186,6,1,0,0,0,2,0
1589,2022-08-28 11:00:01+00:00,WebMD,a clean eat diet start with a focus on veggie fruit and whole grain round this out with healthy protein such as low - fat dairy lean meat fish bean legume nut and seed ,3121144,76279,4829,49,2,1,1,34,236,11,0,0,0,1,2,0
1590,2022-08-24 22:30:01+00:00,WebMD,eat protein be an easy way to curb sugar craving high - protein food digest more slowly keep you feel full for long pick protein like lean chicken low - fat yogurt egg nut or bean ,3121144,76279,4829,47,2,2,1,34,248,8,0,0,0,0,2,0
1591,2022-05-26 07:55:24+00:00,ramarjunfollows,good source of vitamin b can be your favourite food which include- milk- eggs- yogurt- fatty fishes- red meat- clams- fortify cereal arjunhealthcareforall ,15196,69190,118319,14,2,1,0,30,171,5,1,0,0,1,0,0
1592,2022-10-10 10:00:09+00:00,Kon__K,I make a greek mezze platter for my mum for dinner homemade toursi stuff eggplant with feta I grill zucchinieggplant slice raw fennel make tzatziki boil horta artichoke pepper pickle my marinated feta amp olive asparagus prune amp nut and raw veggie ,80227,85166,57040,53,93,12,1,43,307,9,2,0,0,2,1,0
1593,2022-09-04 22:54:01+00:00,Tomoka881,seafood platter prawn crumble fish rosey salami olives soybeansyummyfoodlover seafood ,1391,1582,916,17,4,0,1,16,129,0,3,0,0,0,1,4
1594,2022-02-14 10:49:31+00:00,Swartland,swartland winery famous platter be pile high with local cheese cure meat biltong amp drowor olive seasonal fruit and crisp - toast bread swartlandsecret sipswartland swartland ,1847,5082,7785,10,1,1,1,25,224,3,3,0,0,0,1,0
1595,2022-03-03 07:11:26+00:00,josenworldv2,yo tonight be not my good night man there be a new nigga at the deli and bro this chop cheese be horrible man like why this nigga even here bro like do you know I have not eat gyro in fucking day bro and this how u do I bro like I be so appalled spalde ball fr ,1315,15595,17111,5,3,0,0,58,270,24,0,0,1,1,0,0
1596,2022-01-23 22:59:44+00:00,josenworldv2,josen moncler moncler za warzone gyro faze obama new york city chop cheese fuck da opps meta verse perky in her butt make she shit it when we fuck drill beat sample elon musk tesla canes dutch master more zaza call of duty music ,1315,15595,17111,3,0,0,0,44,233,10,0,0,0,0,0,0
1597,2022-02-17 12:57:20+00:00,MadHatterMommy,I buy premium lettuce day ago which I have yet to use be live on the edge you guy ,18295,104880,121415,66,5,0,0,20,93,7,0,0,1,2,0,0
1598,2022-10-27 05:11:19+00:00,hsdlot,if anyone else be dress up as a condiment please reveal yourself oh there be another condiment there have there be some grape some grape sushi over there that have that be not a condiment - harry look for more condiment costume at loveontourla ,117238,9240,133,116,8,48,0,38,237,18,1,0,0,0,0,0
1599,2022-06-07 16:47:39+00:00,CameronWolfe,a lot of food take from dolphin hc mike mcdaniel on final week of ota include this excellent one bbq be no condimentmcdaniel say he do not eat fish but do eat sushi as a medium for wasabi big fan of red gravy aka hot sauce ,60625,34723,5341,16,1,3,1,47,268,13,1,0,0,3,1,0
1600,2022-02-07 21:36:02+00:00,motokorich,what be sushi or soba without wasabi with climate change age farmer and overgrown cedar in japan the indispensable head - clearing condiment be at risk w and photo by ,45382,21150,11443,76,14,8,0,31,220,10,0,2,0,0,1,0
1601,2022-11-08 23:08:01+00:00,chefdehome,recipeoftheday easy lemon chicken piccata chicken piccata with lite and crispy cook chicken thigh in a delicious lemony caper and garlic piccata pan sauce a restaurant - quality chicken piccata dinner that you can make at home in min ,4128,17332,7827,11,1,0,1,39,294,11,2,0,0,1,2,2
1602,2022-10-24 01:00:49+00:00,EatingWell,this one - pan pasta that combine lean chicken breast and saute spinach for a one - bowl meal be garlicky lemony and good serve with a little parm on top ,213385,34969,2474,10,2,1,0,28,179,9,0,0,0,0,1,0
1603,2022-10-09 19:21:00+00:00,chefdehome,recipeoftheday chicken piccata try this lite and crispy cook chicken thigh in a delicious lemony caper and garlic piccata pan sauce a restaurant - quality chicken piccata dinner that you can make at home in min ,4128,17332,7827,33,1,0,1,36,266,11,1,0,0,1,2,2
1604,2022-09-07 08:46:18+00:00,PoltclCassandra,lettuce talk about the south asian rice pudding firni more decadent than a humble kheer and ridiculously easy garnish it with nuts silver varq amp rise petal ,2398,52847,33791,9,13,0,4,28,189,8,0,0,0,0,1,0
1605,2022-12-14 10:28:58+00:00,leaurique,if michelin only know claypot chicken rice be good when slightly char juicy and meaty chicken most be dry full of bone in dark sweet sauce some thinly slice chinese sausage with a side of salt fish julienned ginger in oil and a generous splash of green condiment ,488,66001,2660,19,5,5,1,49,303,17,0,0,0,0,1,0
1606,2022-10-25 16:33:57+00:00,Ellie_Krieger,this stew of fragrant spice - infuse tomato sauce tender bite of chicken thigh meaty chickpeas amp ribbon of spinach taste like a complicated long - cook meal but it have it be quite simple and ready in hr chickpeas easyrecipe weeknightdinner ,25197,13733,12546,4,3,1,1,38,302,8,5,0,0,0,2,0
1607,2022-10-06 06:01:05+00:00,seriouseats,a meaty stew feature big chunk of beef pork and sausage simmer until fall - apart tender in a deep and rich tomato sauce ,814029,35742,3868,4,1,0,0,23,151,6,0,0,0,1,1,0
1608,2022-12-07 02:05:30+00:00,SkinnerPm,home late but have time to make one of the good soupstew theresa and I have ever enjoy from it have it be doenjang chigae a savory spicy - but - not - hot - at - all flavor bomb of a soup start to finish be maybe minute ,75901,52379,18274,12,9,1,2,39,251,15,0,1,1,1,1,0
1609,2022-12-06 23:15:43+00:00,mentalcasemama,sometimes it have it be just a simple soup pasta e fagioli pa - stah eh fadj oh lee be one of my favorite it have it be hearty and savory perfect for when it have it be cold top with some extra virgin olive oil and parmigiano reggiano ,24565,22800,155021,44,205,5,1,39,240,12,0,0,0,0,1,0
1610,2022-11-19 17:34:00+00:00,foodandwine,cozy up with a rich savory bowl of potato - and - broccoli soup tonight ,6945117,168576,4627,16,1,0,1,13,117,4,0,0,0,0,2,0
1611,2022-10-12 21:36:53+00:00,nardaaa__,somebody say the taylor port ingredient be henny amp grape ,669,7821,13671,5,1,0,0,10,66,2,0,0,0,0,0,3
1612,2022-09-12 15:25:03+00:00,HolisticRituals,antioxidant blast shot ingredient pomegranate a handful of grapesg of redcurrant vial be make ,3537,12492,1679,39,5,2,1,20,140,4,0,0,2,1,1,2
1613,2022-08-18 19:59:27+00:00,PathToLCS,what have what be cook with grape this episode focus on two particularly spicy ingredient ginger turmeric pathtolcs ,7453,3195,2329,7,4,3,1,23,178,3,1,2,0,0,1,2
1614,2022-06-25 13:00:32+00:00,NationalDayCal,do you know the word parfait be french for perfect a traditional parfait be a dessert of custard or ice cream smother with fruit and whip cream in a tall stem glass nationalstrawberryparfaitday be a perfect day to try one of these ,45576,16393,64199,4,1,0,1,44,292,17,1,0,0,1,2,0
1615,2022-05-19 18:55:16+00:00,thewritertype,caramel ice cream with peanut butter marshmallow and fudge all smother in chocolate sauce what a time to be alive but not for long obviously ,29151,63822,9944,5,5,0,0,25,149,9,0,0,0,0,0,0
1616,2022-11-19 09:04:07+00:00,pepperpongpat,black truffle calzonepepperpongpat ,15729,2746,5036,31,4,1,1,5,60,0,1,0,0,0,1,0
1617,2022-11-14 14:42:18+00:00,Karls_Cabin,this beautiful fresh fish be sushi grade fresh cut in house serve w a pickle brussels sprout salad fresh mandarin spice almond scallion vinaigrette and top with crispy noodle karlscabin sear ahi yellowfin tuna ,1910,9474,2861,28,5,0,1,36,279,5,5,0,0,0,2,0
1618,2022-06-18 21:55:46+00:00,Chynableu,hubbys father day dinner pan sear ribeye steak indian spice potato wedge and broil garlic butter asparagus thank you whisper meadow family farm for your support ,23755,29173,56124,70,21,4,1,30,206,4,0,0,0,0,1,3
1619,2022-05-04 21:48:09+00:00,Chynableu,indian spice pan sear salmon with mint chutney dry fry cumin okramushroom and basmati rice ,23755,29173,56124,25,10,2,1,17,124,2,0,0,0,0,1,1
1620,2022-09-27 03:52:00+00:00,agingdoc1,six - month intervention with wild blueberry improve speed of processing in mild cognitive decline a double - blind placebo - control randomized clinical trial ,15357,36891,63573,7,0,0,1,21,211,4,0,0,0,0,2,0
1621,2022-03-08 22:11:40+00:00,Lixxpy,meet blueberry blu for short he be a mild and gentle lycanroc he have he be always down to meet new friend do not worry he will not bite art by ,116,3990,4244,9,1,0,1,28,175,10,0,1,0,0,1,0
1622,2022-01-25 14:14:53+00:00,interest_mild,insanely large blueberry ,9963,47965,5,9,5,3,1,4,51,0,0,0,0,0,1,0
1623,2022-03-16 12:19:10+00:00,MriSlt,our global tea party be live we be join by our ward patient we have cake and pure diet dessert for patient and staff to tuck into patient consent give for picture nhweek swallowaware ,266,73,76,5,1,0,4,41,294,11,2,5,1,2,1,1
1624,2022-11-05 15:56:47+00:00,B_Brown77,titania and puckate a magic mushroom tartmidsummer caper vss caper haiku ,3641,9212,32838,11,6,0,1,15,109,2,3,0,0,0,1,1
1625,2022-11-21 23:50:00+00:00,RetroCoast,the grill cheese sandwich be americas most beloved sandwich but it be bear during tough time the grill cheese be invent during the great depression of the shamburger be expensive but cheese be cheap a grill cheese be an affordable hot tasty meal ,56228,40894,186361,27,19,3,1,45,300,15,0,0,0,1,1,0
1626,2022-08-31 19:54:50+00:00,Pattihatestrump,so I just see some fking magat spout off about how tough he be and how he have he be ready to kick ass his face look like hamburger two black eye and an obviously break nosedudei have I would wait until your face heal up before spout that garbageyou idiot kill I ,24232,51646,160915,4,4,0,0,47,271,19,0,0,0,2,0,9
1627,2022-06-16 18:50:23+00:00,RetroCoast,the grill cheese sandwich be americas most beloved sandwich but it be bear during tough time the grill cheese be invent during the great depression of the shamburger be expensive but cheese be cheap a grill cheese be an affordable hot tasty meal ,56228,40894,186361,24,20,3,1,45,300,15,0,0,0,1,1,0
1628,2022-08-14 19:56:38+00:00,nyladavis1990,it have it be I againvote timecooke dinner for my mom and aunt spaghetti and meatball and toasted ravioli with spinach and ricotta cheese so for dessert should I make red velvet cupcake peach cobbler or turtle cheesecake they like all flight land at thank ,15606,17108,46521,6,153,7,0,46,275,14,0,0,0,1,0,2
1629,2022-12-04 07:22:30+00:00,fawwazrasydan,have raman at maruki the linc kl after a productive morning squash session we try classic shoyu clear shoyu spicy and garlic broth rich and fill - mid range price point perfect meal for a cold rainy day ,4752,30069,10853,3,2,3,2,39,239,7,0,0,0,1,1,0
1630,2022-12-01 22:57:39+00:00,gilmcgowan,this be rich member of the government that be in the midst of an attempt to squash democratic norm and stage an executive coup call the opposition nazi to try to defend democracy in alberta this be gaslighte of the high order ableg abpoli cdnpoli ,20537,45262,32197,74,40,2,0,46,290,20,4,0,0,0,1,0
