,date,author,text,followers,status,favourites,retweets,replies,quotes,media,word_count,char_count,stop_words,#tag,@,numaric,upercase,URLs,emojis_count
773,2022-12-01 21:00:03+00:00,seriouseats,the ultimate in luxurious roast beef wellington combine beef tenderloin a rich mushroom duxelle foie gra and prosciutto all wrap in a buttery puff pastry crust ,814029,35742,3868,5,2,0,0,27,197,6,0,0,0,0,1,0
774,2022-08-11 07:22:17+00:00,amalnotclooney,lol I know this tweet be mean to be funny but actually whyyyy do we follow westerncolonizer breakfast rule cereal be not delicious stop lie hate it I hate sweet thing for brekkie curry and other indian amp eastern food be actually fill amp pack w nutrient ,1042,24364,49923,3,2,0,0,49,310,13,0,0,0,2,1,1
775,2022-06-14 03:36:13+00:00,TheMisterMarcus,you all know damn well that they be give curry final mvp if they win wiggin clown tonight but lettuce be cereal ,51715,334402,4723,5,7,4,0,20,117,6,0,0,0,1,0,0
776,2022-04-22 15:02:04+00:00,BassetlawB,our list this week be cerealravioli in tinscurry saucepotinstant noodletoilet rollrice puddingcustardporridgecoffeetinne dog foodbleachcup - a - soupstage baby milkthank youbassetlawfoodbank foodbank bassetlaw shortageslist needslist thankyou ,305,693,309,4,2,0,1,40,295,2,6,0,1,0,1,2
777,2022-12-06 19:49:20+00:00,BradSherman,be pleased to celebrate national kimchi day with colleagues korean - americans and kapac congress should pass hr recognize it kimchi be as american as matzoh ball soup kimchi be as american as apple pie ,90784,4230,154,5,7,7,1,35,246,10,2,0,1,2,1,0
778,2022-12-06 18:53:32+00:00,RedwallFeasts,the centerpiece of the feast be a large cauldron of shrimp soup the loamhedge cook produce strawberry flan damson pie pear tart with meadowcream and apple n blackcurrant crumble there be motherwort tea and a great deal of buttercup an honey fizz cordial ,27515,4986,0,11,1,1,0,43,270,11,0,0,0,0,0,0
779,2022-12-01 23:40:08+00:00,PhillyFillyLIVE,dinner tonightnon - traditional grill cheese of leftover slicedsaute brussel sprout pumpkin butter cheddar amp brie with store - buy butternut squash amp apple soup philly foodie ,2652,12445,26704,6,9,0,1,24,217,2,2,0,0,0,1,0
780,2022-12-07 18:03:04+00:00,AustinJohnPlays,so this be neat there have there be an unnamed default sandwich you can make with chorizo salt and pepper that will give you no buff whatsoever it shall it will award cooking exp but not override your current buff ,182394,17933,18201,223,49,6,2,35,222,16,0,0,0,0,1,0
781,2022-12-06 17:12:17+00:00,bouzingot,to those who struggle with cooking sandwich be the solution to all your problem you can have a sandwich for any meal experiment with flavour - mix salt and sweet for every ingredient that exist there have there be a new sandwich combination that have not be try ,579,7948,87283,3,2,1,0,45,287,23,0,0,0,0,1,0
782,2022-12-04 06:36:31+00:00,marydever8,hi all no cooking tonight so it have it be a yummy prosciutto tomato lettuce tomato cheese amp avocado sandwich a cold beer for the them amp a moscato for I enjoy your evening everyone ,817,20733,79296,28,36,5,1,35,216,8,0,0,0,1,1,2
783,2022-09-25 12:41:25+00:00,Lowcarbjiji,shawarma bowlshawarma chicken thighs feta cheese grape tomato cucumber andtzatzkiki tag someone who would love this by -daliciousdishmaindishketodinnerketolunchcheeseketosnacksketosnackketodessertketoketorecipeslowcarbhighfatlchf ,11440,2880,2267,31,4,1,1,37,296,5,11,0,0,2,1,4
784,2022-12-03 10:35:05+00:00,sat_jamesmartin,another dessert that would be great as an alternative to christmas pudding this festive seasonwhite chocolate and whisky croissant butter pudding creamy buttery heaven with a little whisky kick serve lucky people ,63004,4112,4884,5,8,0,1,36,272,10,0,0,1,0,2,1
785,2022-11-21 19:30:17+00:00,kimschob,a homemade chocolate chip whoopie pie with cherry these soft buttery chocolate chip and cherry whoopie pie be fill with buttercream whoopiepie chocolatechips dessert kimschob ,2908,39046,17260,5,2,0,1,27,237,4,4,0,0,1,2,0
786,2022-11-20 15:00:03+00:00,re_hungry,happy sunday lovely hungry need a little sweetness try this fruity beauty - recipe buttery pastry pack with crisp apple amp soft blackberry - perfect for share stay hungry x bakeithappen fruit pie dessert icecream delicious ,11171,44131,82329,16,6,1,1,39,299,4,10,0,0,0,2,0
787,2022-12-12 21:39:42+00:00,JaneyGodley,the flag banger be back give the poor people cheap spaghetti hoop and bread recipe again ,281135,371133,95693,516,599,70,1,17,120,5,0,0,0,0,1,0
788,2022-12-12 21:21:44+00:00,rob_heighton,I want to see these people feed nothing but aldi own brand spaghetti hoop and the cheap bread and similarly price item for every meal I want to see their soul diminish over time as they understand the predicament for which they be advocate ,3290,26146,231734,6,3,0,0,44,275,19,0,0,0,2,1,0
789,2022-12-10 08:30:38+00:00,Bams_Jnr,rice bread spaghetti yammacaroni irish and sweet potatoesnoodle plantain tired of these food fr ,73072,243349,109235,7,11,2,0,16,105,3,0,0,0,0,0,0
790,2022-09-25 11:55:19+00:00,ROSEANNE_DAYS,tran op ask ros for dinner recommendation taco or rice braise seaweed kimchi and spamop say but start today to eat be rice laver kimchi soy sauce amp spam be you go to do hard to love on concert that have that be a secretbparea ,89823,32642,58,133,3,13,1,48,291,12,1,0,0,4,1,4
791,2022-04-20 13:54:53+00:00,intothe1130,my mom cook I meal she come to hybe to give I the food so I will eat it with engene now there be galbijjim braised rib and seaweed soup ,24251,1390,263,842,6,176,0,34,183,17,0,2,0,1,0,0
792,2022-03-21 12:26:01+00:00,theoloriherself,come and patronize we pleasefor your cake chop succulent doughnut and food plattersabujatwittercommunity ,24543,296482,120687,22,2,1,3,17,163,4,1,0,0,0,2,1
793,2022-10-16 11:10:24+00:00,Bramblings22,it have it be a beautiful day be collect leave and walnut again and rake up grass other side of fence ready for wild flower seed well late than never happy sunday everyonegardene gardeningtwitter ,14335,27320,133898,9,5,0,1,33,230,10,3,0,0,0,1,0
794,2022-09-03 11:19:54+00:00,drdenwalker,some nut be pack w butyrate which support gut lining amp mitochondria cashews amp peanut not a true nut be actually seed fill with lectin good nut like walnut macadamia nuts hazelnut and pistachiosee other great food choice ,36701,13441,5676,13,4,0,0,40,276,7,0,0,0,0,1,0
795,2022-07-20 13:40:01+00:00,DrKristieLeong,switch highly process seed oil like corn and soybean oil for olive oil walnut or avocado oil the latter be high in omega- fat and may reduce the inflammatory burden on your body health healthandsafety healthydiet ,34471,156718,378768,13,5,1,0,36,230,11,3,0,0,0,0,0
796,2022-12-02 18:00:02+00:00,WebMD,walnut may help protect you against prostate cancer and keep your brain sharp as you age and accord to one study you be more likely to eat healthy overall if they be a regular part of your diet ,3121144,76279,4829,44,6,6,1,38,249,17,0,0,0,0,2,0
797,2022-11-21 01:25:15+00:00,StrangeLounge,it have it be bitterly cold in chicago so we make sure every last one of the squirrel in the park be healthy and feed find black squirrel and a few tiny baby pecan almond amp walnut to fill the belly chicagosquirrel ,198,3075,30133,5,4,1,1,42,252,18,1,0,1,0,1,2
798,2022-11-08 03:25:17+00:00,PypAyurved,relish the taste of healthy breakfast with patanjali walnut one of the easy way to improve your health be to eat raw walnutsshop now patanjali patanjaliproduct healthyberakfast driedfruit walnuts healthcare wintercare ,91617,18168,2468,7,1,0,1,36,284,9,7,0,0,0,2,0
799,2022-12-08 18:54:12+00:00,DisneyFoodBlog,chef at animal kingdom lodge have also introduce two new bowl first up we have get the chermoula - spice shrimp bowl with grill shrimp pilau rice kale slaw cucumber - tomato salad and chermoula sour cream ,206660,111321,35086,4,1,0,1,33,235,7,0,0,0,0,1,0
800,2022-12-06 20:54:29+00:00,Simp4Sluts,grill cheese on rosemary sour dough ,6999,38979,70003,7,6,1,1,7,61,1,0,0,0,0,1,0
801,2022-11-16 19:23:10+00:00,MphoMasoleng,pork kassler chop prawn grill orange sweet potato cauliflower red onion on a bed of asian leaf salad with feta amp ricotta cheese homemade rise red chilli amp sour cream dress munchwithmpho ,3843,32786,88712,35,31,1,1,35,231,4,1,0,0,0,1,2
802,2022-06-15 07:45:21+00:00,RootCauseDoctor,the meat organ fruit and honey dietary prescription by be appropriate advice for homo sapien live its evolutionary niche - highly active sun - expose and live in an equatorial latitude problem be that do not describe most people brief thread ,22481,2955,4395,29,6,6,0,39,268,11,0,1,0,0,0,0
803,2022-07-02 23:27:46+00:00,Gothalion,thinkin about do stuff pepper but with shred buffalo chicken mix with some diced tomato and celery top with a lil melt bleu cheese crumble ,328768,86288,7929,7,50,1,0,26,162,9,0,0,0,0,0,3
804,2022-04-07 06:50:30+00:00,GreenwichCork,hello cork open from am for crispy bacon with your free range scramble egg fluffy waffle durrus melt crispy bacon bap creamy porridge amp freshly baked blueberry scones greenwich caroline street behind behind brown thomas ,4218,39013,11956,15,1,1,1,37,271,6,0,0,1,0,1,0
805,2022-12-08 17:35:16+00:00,CulinaryCheats,the saga continue root veggie lolgot some random free pork chop from family brussel sprout amp carrot roast amp toss in a savory sweet maple sauce ,1098,4628,6215,17,6,0,1,30,198,4,0,0,0,0,1,5
806,2022-12-08 16:41:12+00:00,kimyanattalie,in a world of sweet candy - like spareribs search for the savory pork of yore ,1296,7171,4743,3,1,2,0,16,113,5,0,1,0,0,1,0
807,2022-11-15 01:00:00+00:00,tastemade,bake with lot of cheese and tiny tomato this pork - stuff eggplant dish be the definition of savory goodness ,425685,29944,14625,28,1,2,1,19,138,7,0,0,0,0,1,0
808,2022-10-13 17:37:55+00:00,KitchenSanc2ary,chicken pakora - tender chicken marinate in a blend of fragrant spice then coat in a chickpea flour - base batter for that signature mild nutty taste fry until beautifully golden and crisp pakora glutenfree fakeaway ,74638,65768,60686,92,9,11,1,36,277,10,3,0,0,0,2,2
809,2022-06-10 07:40:02+00:00,KitchenSanc2ary,chicken pakora - tender chicken marinate in a blend of fragrant spice then coat in a light batter and fry until beautifully golden and crispchickenpakora fakeaway pakora glutenfreerecipe ,74638,65768,60686,38,4,1,1,31,246,9,4,0,0,0,2,0
810,2022-02-26 13:10:10+00:00,KitchenSanc2ary,chicken pakora - tender chicken marinate in a blend of fragrant spice then coat in a light batter and fry until beautifully golden and crispchickenpakora glutenfree fakeaway ,74638,65768,60686,45,4,4,1,30,232,9,3,0,0,0,2,0
811,2022-12-14 09:27:46+00:00,DoctorGeorge15,my mum stuff vegetable cook in the oven be the good eatwog greek ,483,8175,14911,3,3,2,1,16,118,4,2,1,0,0,1,1
812,2022-12-10 03:25:46+00:00,badnocs,make dinner for guestschinese food tonightcooke vegetable color capsicummushroomsonion rouge green chilliestomatoes tomato sauceblack bean saucestir fry rice with vege amp eggnoodlesstir fry chickenvegetable salad ,36776,129386,147994,14,15,1,4,38,264,2,0,0,1,0,1,0
813,2022-12-08 02:21:28+00:00,wehealthy3,semi cook mix veggie with baby zucchini red capsicum yellow capsicum mushroom carrot baby potato olive oil with sesame seed eat with pita brown rice lentil or just have in evening vegan healthy green loveyourself vegetable meal food nodrug nowar ,2457,2094,1258,4,3,0,1,42,299,7,9,0,0,0,1,0
814,2022-11-07 00:22:59+00:00,_drazzari,a lazy sundayfunday with oyster on the half shell and a ros of pinot noir by a pinksociety party guest in december this one show aroma of cherry pear and lemon - lime with taste of cranberry hibiscus and steely watermelon cheer ,9880,181964,186432,10,1,1,1,44,298,15,2,3,0,1,1,0
815,2022-11-03 19:06:40+00:00,Ginofantastico,break cocktail news we have create a new signature drink if my grandmother have wheel make with ginato gin aperol watermelon raspberry pink grapefruit and lime let I know what you guy think gdx ,1843199,12435,4796,10,13,2,1,37,257,9,0,1,0,3,1,1
816,2022-10-31 13:12:30+00:00,lubamagnus,happy halloween to everyone who have who be unsure if the green lollipop they just get will be apple watermelon or lime ,948,2251,6149,3,1,0,0,19,111,9,0,0,0,0,0,0
817,2022-10-07 07:54:43+00:00,w_karve,food vegetarian punemoong dal khichdi with a dollop of pure ghee lentil rice spice kedgeree with a dollop of clarify butter pithla spicy chickpeagram flour porridge polichapati wheat flat bread tomato slice green chili taak fresh buttermilk shrikhand ,12587,89771,106583,5,9,2,1,46,304,6,3,0,0,0,1,0
818,2022-09-29 15:29:15+00:00,Block16Omaha,fry pcf buttermilk thighs b pork green chili fry and a corn biscuit with cayenne honey butter come see we ,11412,5860,8908,3,3,1,1,21,143,4,0,0,0,2,1,0
819,2022-09-24 00:24:56+00:00,CajunMallard,buttermilk fry chicken slider just plain experiment w south carolina bbq sauce amp hot sweet chili sauce top with ranch money ,1166,5975,53969,8,8,0,2,27,208,2,1,3,2,1,1,0
820,2022-12-14 17:09:27+00:00,asmorsh,so accord to zionist simply eat meat and yogurt together do by many people around the world for the long time be barbaric but genocide and ethnic cleansing be not ,706,6243,29358,28,5,0,0,30,199,12,0,0,0,0,1,0
821,2022-12-11 06:14:59+00:00,NomeDaBarbarian,til that australia have a dish call a halal snack pack or hsp which be pretty much kebab poutine - chip thick cut fry top w kebab meat drench in chili garlic and bbq sauce also sometimes cheese yogurt jalapenos tabboulehwhere have this be all my life ,30731,103338,269675,270,185,211,1,48,304,16,0,0,0,3,1,0
822,2022-12-10 01:41:59+00:00,DoctorTro,no aisle be safe anymorefake yogurtfake cheesefake milkfame eggsfake fishfake meatfake chickenfake steakfake sausage gmo producepesticide producethey have infiltrate your precious perimeterouter aisle ,74128,63223,9,20,13,2,1,35,241,3,0,0,0,1,1,0
823,2022-11-14 03:46:22+00:00,KingHermitCrab,art challenge draw your persona in a pink fluffy robe hold a wine glass read complete bullshit from their phone ,4398,74398,167818,24,18,33,0,21,142,6,0,0,0,0,1,0
824,2022-09-15 15:46:13+00:00,BornBruin77,grab your box of tissue go get that bottle of wine or tub of ice cream get the fluffy blanket and get ready for that warm fuzzy feeling inside the bromance be back for another season goaliehug retweet be appreciate ,659,7882,7195,13,3,3,1,46,297,17,1,3,0,0,1,0
825,2022-09-10 04:00:02+00:00,NUCarnivalEn,happy mid - autumn festival as the moon shine brighteiden and his comrade enjoy a sip of winewait where do all these cute little bunny come fromah it seem our fluffy new friend have take a liking to master quincy much to topper dismaynucarnival ,191386,340,0,3133,78,344,1,49,301,16,1,0,0,0,1,2
826,2022-12-14 19:41:55+00:00,_LOVELYSPAIN_,the tarta de santiago or torta compostelana be a traditional dessert of galician cuisine this delicious almond cake can not be miss from the table on july the day of the festival of santiago and the day of galicia the recipe consist mainly of almond sugar and egg ,12229,3476,7166,17,4,1,1,49,302,18,0,0,0,0,1,0
827,2022-12-14 09:55:42+00:00,mohd_ridakhan,healthy chocolate date cake make with the ingredient semolina oats chocolate chop datesalmond milk oil dessert food foodie ,2444,63724,65872,4,4,0,1,20,176,3,4,1,0,0,1,0
828,2022-12-14 06:16:34+00:00,urbanangel87,we be not go to get into the trifle mince pie and fruit cake debate just get yourself the chocolate cake kit and everyone will be smile I bake a chocolate orange cake top with mascarpone frost and toast almond ,1400,36352,114449,4,1,0,3,42,269,17,0,1,0,1,1,0
829,2022-11-30 14:01:17+00:00,PurleyFoodHub,please share our post so they can be see more widelyour december listlong life whole milk tin plain meat tin peascarrot tin fruit squash christmas biscuit chocolate treat mince pies children christmas dessertswashe up liquid ,926,675,206,16,2,0,1,47,294,6,0,0,0,0,1,10
830,2022-11-29 23:07:34+00:00,MatKendrick,big thank to for invite I and to vp to watch the match tonight confession I have two dessert and hoover up the wasabi pea and pork scratching like a hungry hippo as can testify cheer pal ,36168,72968,32303,4,3,1,0,46,264,15,0,4,0,3,0,5
831,2022-11-29 00:31:00+00:00,KellyClarksonTV,it have it be a thanksgiving trifle turn your leftover into dessert just leave out the beef with pea and onion get courtney recipe ,120248,12665,11344,12,3,1,1,25,182,8,1,0,0,0,2,1
832,2022-12-12 16:04:58+00:00,realRawPaul,fbi reveal it have more information on deceased dnc staffer seth richwait for musk to drop the seth rich twitter file kim dot com involve also cuz he be the middle man between rich and assange we live in juicy time ,13782,12165,5401,36,7,2,0,42,225,11,0,0,0,3,0,0
833,2022-12-08 06:59:22+00:00,LamiTrixxx,lol I really understanda an influencer I get juicy offer to support tinubu too make I no lie the offer be temptingbut that money be not be not be not have not have not worth the life that have be lose and will be lose if we allow a terrible government againfor some of we we be not be not be not have not have not rich ,25981,98503,147880,17,10,1,0,53,304,20,0,0,0,3,1,0
834,2022-12-03 19:07:10+00:00,Hard2Keel,I think you just jealous of these juicy rich thick ebony fertile breast but ok ,898,10057,5197,46,18,35,0,16,104,5,0,0,0,1,1,0
835,2022-12-01 17:55:52+00:00,Bickley_Marotta,mockmyworld good pie pizza - banana cream - french silk - strawberry rhubarb apple - sweet potato - lemon meringue - cheesecake pumpkin - blackberry - key lime - pecan peach - chicken pot - cherry - shepherd ,19338,22859,1447,6,26,1,0,18,199,0,1,0,4,0,0,0
836,2022-11-30 12:10:11+00:00,damian_from,I be watch pmqs in hd be it just I or do have a drinker nose it look like a cross between an overripe strawberry and a potatonosegate ,25070,90108,34559,21,8,4,0,30,163,14,2,1,0,2,0,0
837,2022-11-17 21:52:54+00:00,Sheena_Marie3,make the follow cheesecake available for order until for ny style sweet potato banana pudding butter pecan red velvet oreocobbler peach strawberry cheesecake local drop off in triad charlotte waxhaw matthews fort mill ,26990,63601,27298,9,16,5,4,47,290,5,0,0,0,1,1,0
838,2022-07-02 23:27:46+00:00,Gothalion,thinkin about do stuff pepper but with shred buffalo chicken mix with some diced tomato and celery top with a lil melt bleu cheese crumble ,328768,86288,7929,7,50,1,0,26,162,9,0,0,0,0,0,3
839,2022-08-26 15:13:21+00:00,clodaghmckenna,learn how to pickle beetroot in my late episode of our little sustainable farm over on youtube tap the link to watch ,44601,16709,13765,4,1,0,1,24,167,9,0,0,0,0,2,0
840,2022-06-21 07:32:09+00:00,nickykylegarden,happy summersolstice hope you all have a lovely one my polytunnel be a lush jungle - with rosada tomato ripe early courgette ready strawberry and basil abundant and gherkin develop fast than you can say pickleorganic peatfree sustainable healthyfood ,13575,63382,70660,9,4,1,4,40,302,13,6,0,0,0,1,1
841,2022-02-25 21:08:00+00:00,SolidarityFrdge,we be strive to create healthier less processed and more sustainable meal for our community we be always in need of donation such as soy vegan mayo celery yellow mustard pickle tomato cilantro cucumber jalapeo v tomato sauce ,418,192,190,6,1,0,0,46,258,12,0,0,0,0,0,7
842,2022-12-07 22:35:06+00:00,BTC_JackSparrow,I just come across this so next time some wake blonde give I a speech about cocaine not be ethical while preach about her morning avocado salmon poach egg toast this will be my rebuttal ,250986,42078,122615,4,20,2,1,36,221,17,0,0,0,1,1,0
843,2022-12-04 07:21:17+00:00,pinktearoom,good morning you gorgious lot wish you a wonderful and relaxing sundayhow about smoke salmon and poach egg on avocado toast for breakfast nutritionaltherapy menopausenutrition midlife weightlossjourney nutritionaltherapist ,14387,14812,31147,3,10,0,1,31,289,6,6,0,0,0,2,0
844,2022-11-30 19:55:39+00:00,TheGringoDegen,anyone want a toast toon salmondkwhere be waldofollow amp tag some friend you toast up with hr giveaway nftcommunity nftgiveaway nft maxtoast ,1132,1486,1847,284,317,2,1,29,234,4,4,2,1,5,1,3
845,2022-11-23 18:30:50+00:00,BradenGall,the sec as thanksgive itemsbama turkeyuga hamlsu stuffingflorida mash potatoesauburn green beanstenn pumpkin pietamu cranberry saucekentucky pecan piearkansas sweet potatoesmiss winemiss st beers carolina rollsmizzou devil eggsvandy salad ,14997,87672,149,14,24,10,0,42,274,1,0,0,0,4,0,0
846,2022-11-23 14:44:10+00:00,17LucyLucy,turkey or ham sweet potato or yam string or collard beanssweet potato or pecan pie football or parademe turkey sweet potato stre bean pecan and football ,21700,36427,44356,4,39,2,0,28,179,6,0,0,0,0,0,2
847,2022-07-02 12:45:00+00:00,HomecominFL,holiday weekend brunch be the name of the game with our - three egg of any style join force with pecan - smoke bacon griddle country ham a cheddar cheese drop biscuit and your choice of two side for one heckuva brunch experience ,5940,2776,3612,4,1,0,1,43,278,17,0,0,0,0,1,0
848,2022-11-15 21:05:12+00:00,stefbarnfather,grocery store be out of lettuce banana orange chicken bread can tuna and juicebut the tower of kitkat gingerbread house reach the ceiling ,10426,17924,50742,3,16,1,1,24,179,7,0,0,0,0,1,0
849,2022-11-07 14:06:21+00:00,janeymcd23,my friend mate have start a little organic delivery business so I sign up this just arrive spud cook apple chard chilli garlic onion parsnip lettuce beet leek a mahoosive red cabbage and homemade apple juiceeu I be in heaven shoplocal ,1855,27499,124004,4,5,0,1,43,296,7,1,0,0,1,1,4
850,2022-11-02 23:47:49+00:00,niemin147,breakfast - croissant sandwich lettuce lunch meat pickle cucumber cheese slice slippery egg -grape juicejasmine tea - yellow peach ,1887,39993,36071,21,1,0,4,22,173,0,0,0,0,0,1,3
851,2022-11-25 19:31:24+00:00,ChaseMit,I get that that there have there be some kind of mushy algorithmy rationale for netflix to only do glass onion one week in theater but as many time as you explain it to I I shall I will never understand it and only part of that be because I be an idiot look at this shit sell out all day ,93899,24142,268163,6,6,3,1,55,297,31,0,0,0,2,1,0
852,2022-10-18 17:48:36+00:00,Saba_Salman,and in case that all sound a little too mushy for you reuben and mannis book be about a lot more likenarniamusical the restorative power of nature how to make lunch with only an onion a swede a carrot and a mr kipling battenburg spoiler alert it have it be tricky ,6743,12648,7888,4,1,0,0,52,297,21,0,0,0,0,1,4
853,2022-10-12 16:24:37+00:00,SteveW69x,it may be my own cooking it may be junk food but flippin eck it be good have a vegan sausage cheeze amp bean melt available from homemade skin on wedge mushy pea amp onion ring veganfood ,22001,37038,105210,3,8,0,1,41,254,13,1,2,0,0,1,2
854,2022-11-17 18:05:49+00:00,stanzipotenza,I as a guest chef on chop the truffle risotto be straight up goate ong bro ,48499,21472,21769,23,8,0,0,16,81,7,0,0,0,0,0,0
855,2022-11-14 23:07:48+00:00,abrittoutside,the same attitude that lead to these crypto company implode be what lead people to make risotto on chop ,1031,196361,29006,8,2,1,0,19,113,9,0,0,0,0,0,0
856,2022-09-23 22:39:46+00:00,jessica_smetana,I just make risotto for the first time in year and I can not fathom that people think they can do this on chop ,107438,25143,83246,3,43,4,0,23,113,14,0,0,0,2,0,0
857,2022-12-12 02:01:04+00:00,wikioccult,the magick of thyme at christmas lie in its ability to bring warmth and comfort to any dish add it to your roast potato or stuff for a touch of holiday cheer thyme christmas herb cook holiday ,4506,7318,11784,8,1,0,1,38,235,15,5,0,0,0,1,0
858,2022-12-07 10:35:20+00:00,thestrongdoc,do not like tofuprobably you never make it the tasty way tofu be a good source of lean protein for vegetarian here be some of the idea to make it yummy marinate in hung curdginger - chilli - garlic paste amp spice grill it pan roast with salt herb amp mexican spice ,2428,2962,2740,7,8,0,1,51,309,19,0,0,0,0,1,0
859,2022-12-07 10:30:33+00:00,WelshLamb_PGI,fancy something a little different for christmas dinnerwhy not ring in the change with our new roast leg of welsh lamb top with herb garlic and lemon and clementine slice recipeyour new christmas tradition start here lovewelshlamb ,17608,6225,4431,79,50,12,1,41,296,12,1,0,0,0,2,0
860,2022-10-12 22:14:37+00:00,Mastino1111,the rspca be appeal for information after an xl american bulldog be find batter to death and dump in push chair in bolton he suffer skull and jaw fracture a bin bag next to the dog contain dog biscuit wrapper amp foam from a dog bed ,746,57126,51777,73,12,6,0,48,282,15,0,0,0,3,1,2
861,2022-06-12 08:05:49+00:00,LesleyM25724591,I be find the anger be good lindsay for do ironing I batter the ironing board and whiz through the pile while mutter my profanity at the tory I be away to batter some digestive biscuit now as I promise the grandkid a cheese cake the tory ,2919,39491,41764,4,2,0,0,48,294,18,0,0,0,2,1,2
862,2022-01-27 09:35:28+00:00,edwinhayward,ambush by cakepersecute by popcornbattere by biscuitsan exciting new trilogy from the maker of the dead before their time viral horror hit come to a cabinet office near you soon ,52285,132753,6499,2,1,0,0,33,194,9,0,0,0,0,0,0
863,2022-02-09 07:16:12+00:00,insectbrah,in a moral society the fda would ban seed oil pasteurize food product chemical dye fluoridate water and corn syrup ,9379,51472,165660,3,3,0,0,20,122,4,0,0,0,1,0,0
864,2022-12-14 19:30:02+00:00,DiningNearMe,choose your dress blue cheese red wine vinaigrette dijon mustard sesame ginger balsamic vinaigrette avocado lime lemon vinaigrette honey mustard ranch buttermilk ,2948,1172,16273,29,63,4,1,33,223,1,0,0,0,0,1,0
865,2022-12-13 15:56:33+00:00,Lowcarbjiji,gram of english cucumber ribbon g cherry tomatoe kalamata olives sprinkle of feta cheese tbsp primal kitchen greek vinaigrette soft boiledegg and of an avocadodo not forget to followusto get daily keto tip and recipesby - wakeupketosleeprepeat ,11440,2880,2267,26,7,0,1,44,295,10,0,0,1,1,1,1
